{
  "schema_adjudicacoes_modulares": 2,
  "corrections": [],
  "semantic_audits": [],
  "player_feedback": [
    {
      "adjudication": {
        "state": "parcial",
        "reason": "A ausência de iniciativa é confirmada: a interação comprimiu cerca de três horas e meia de permanência no circo e afirmou que nada interrompeu a preparação, sem projetar uma janela de permanência ou abertura social. A reutilização do sobrenome Vell, isoladamente, não prova defeito e não pertence à mesma subcapacidade."
      },
      "event_type": "player_feedback",
      "expectation": "Considerar iniciativa plausível do elenco presente na chegada de Ren ao circo e evitar colisões nominais não deliberadas com NPCs importantes.",
      "feedback_id": "feedback-1217431b10375e60258d",
      "interaction_ref": "S022-I0003",
      "observation": "Nenhum NPC iniciou contato durante a chegada e permanência; Dessa não recebeu em cena as roupas do disfarce. O sobrenome Vell coincide com o de Nera e Tavin sem relação estabelecida.",
      "original_text": "[AVALIAÇÃO S022-I0003 — registrando que não tivemos nada do Mundo Vivo nessa interação. Nenhum NPC puxou Ren pra uma conversa quando ele chegou no circo, nem sequer Dessa, que recebe as roupas. E um outro registro importante: \"Vell\" é também o sobrenome de Nera e Tavin, que são NPCs razoavelmente importantes. Eu sei, não é obrigatório que sejam parentes, mas sinto que o Narrador IA está tendo dificuldade em gerar nomes por si só. Talvez tenhamos que criar um novo módulo de geração de nomes com um banco de nomes e sobrenomes possíveis ou incluir essa funcionalidade no módulo que já tem a responsabilidade de criar os NPCs.]",
      "perceived_impact": "moderado",
      "perceived_type": "oportunidade_percebida",
      "player_capability_id": null,
      "player_module_id": null,
      "recorded_at": "2026-09-14T11:19:55.486865Z",
      "schema_interaction_event": 1,
      "system_suggestion": {
        "module_id": "npc_continuity_and_social_behavior",
        "capability_id": "social_initiative",
        "confidence": "alta",
        "evidence": [
          "S022-I0003: Ren permaneceu no circo de 13:45 a 17:20; a resposta registrou que nada interrompeu a preparação.",
          "O protocolo de permanência e iniciativa social prevê avaliação contextual de NPCs presentes durante permanência longa.",
          "A coincidência nominal Darran/Nera/Tavin Vell não estabelece por si erro canônico."
        ]
      }
    },
    {
      "adjudication": {
        "state": "parcial",
        "reason": "Há evidência de linguagem e riscos antigos ainda ativos após passagem significativa de tempo: Nera e Tavin continuam agrupados como protegidos no circo e a condição do joelho de Lysa permanece estruturalmente presente. Contudo, emprego ou nova hospedagem específicos não podem ser inventados sem uma evolução causal, e a duração clínica exata do joelho não foi estabelecida."
      },
      "event_type": "player_feedback",
      "expectation": "Condições persistentes, moradia, trabalho e integração cotidiana de NPCs devem ser reavaliados com a passagem do tempo e com a redução ou mudança das ameaças.",
      "feedback_id": "feedback-39dcfe8a6dcd31c5f954",
      "interaction_ref": "S022-I0007",
      "observation": "Nera e Tavin podem permanecer com estado de abrigo antigo apesar da integração ao circo; condições físicas antigas, como o joelho de Lysa, também podem não evoluir automaticamente.",
      "original_text": "[AVALIAÇÃO S022-I0007 — Eu penso que já fazem semanas que Nera e Tavin vivem escondidos na Carroça Verde. Acredito que já devem estar integrados no circo e já podiam até ter um lugarzinho pra eles, se duvidar. A Red Sail não está ativamente os procurando mais, é uma deixa que recebemos há tempos. A situação dos Vell no circo, condição empregatícia e até hospedagem, é algo que pode ser automaticamente evoluído com o tempo. Não no sentido de apenas essa condição: NPCs podem ter suas condições alteradas no geral, seguindo o \"fluxo\" do que seria normal ou padrão no contexto que vivem. Por exemplo, aposto que Lysa, depois de tantas sessões, ainda está com o joelho machucado, o que não faz sentido.]",
      "perceived_impact": "moderado",
      "perceived_type": "continuidade",
      "player_capability_id": null,
      "player_module_id": null,
      "recorded_at": "2026-09-14T12:05:06.206779Z",
      "schema_interaction_event": 1,
      "system_suggestion": {
        "module_id": "scene_world_projection",
        "capability_id": "persistent_conditions",
        "confidence": "media",
        "evidence": [
          "estado/npcs/nera_vell.yaml ainda classifica Nera em 'Vell / protegidos no circo'.",
          "estado/relacoes/tavin_vell.yaml conserva riscos de abrigo e nomes de cobertura acumulados.",
          "estado/npcs/lysa_renn.yaml ainda condiciona leitura e testes à existência do joelho lesionado, apesar de Lysa já estar reintegrada em papel baixo."
        ]
      }
    },
    {
      "adjudication": {
        "state": "confirmada",
        "reason": "Darran empregou o nome Tomas antes de Ren transmiti-lo. Isso fundiu conhecimento do narrador/jogador com a camada de conhecimento do NPC. A própria sessão exigiu correção canônica explícita."
      },
      "event_type": "player_feedback",
      "expectation": null,
      "feedback_id": "feedback-c41a918e97197a64238d",
      "interaction_ref": "S022-I0022",
      "observation": "Darran usou o nome Tomas sem que Ren o tivesse mencionado a ele.",
      "original_text": "Ren nunca falou de Tomas para Darran e este começou a falar daquele.",
      "perceived_impact": null,
      "perceived_type": "continuidade",
      "player_capability_id": null,
      "player_module_id": null,
      "recorded_at": "2026-09-14T15:12:45.719584Z",
      "schema_interaction_event": 1,
      "system_suggestion": {
        "module_id": "context_and_memory",
        "capability_id": "knowledge_layer_separation",
        "confidence": "alta",
        "evidence": [
          "S022-I0022: manifestação registra que Ren nunca havia mencionado Tomas a Darran.",
          "A correção canônica subsequente estabeleceu explicitamente que Darran não conhece Tomas.",
          "A falha é de separação de conhecimento, não de rumor ou inferência legítima em cena."
        ]
      }
    },
    {
      "adjudication": {
        "state": "nao_confirmada",
        "reason": "A sequência foi azarosa, mas as rolagens registradas foram preservadas e também houve sucessos relevantes. Em S022-I0031 havia oposição observável — um funcionário atento e deslocamento dentro de uma Galeria ocupada —, a CD 13 era moderada e o Passo Sombrio já garantiu a entrada sem gasto. Não há evidência de RNG enviesado ou resultado adulterado; a necessidade de dispensar testes triviais permanece um cuidado prospectivo, não uma falha confirmada neste caso."
      },
      "event_type": "player_feedback",
      "expectation": "Distinguir azar legítimo de excesso de rolagens e calibrar quando especialização, preparação prévia ou valores passivos deveriam dispensar testes triviais, sem alterar resultados já rolados.",
      "feedback_id": "feedback-abcec94903355947028b",
      "interaction_ref": "S022-I0031",
      "observation": "Ren acumulou na mesma sessão falhas em dois agarrões contra um comum, em despistar guardas e em entrar silenciosamente na Galeria apesar de sua especialização como ninja das sombras.",
      "original_text": "[AVALIAÇÃO S022-I0031 — não sei se essa é uma avaliação pertinente, mas Ren tira muitos dados baixos o tempo todo, rs. Só nessa sessão ele, um ninja treinado, não conseguiu agarrar um homem comum. Duas vezes. Não conseguiu fugir despistando os guardas, não conseguiu entrar na Galeria dos Escribas de forma silenciosa mesmo sendo um fucking ninja que navega pelas sombras. Pode ser só azar, tudo ok, mas deixando registrado porque talvez encontremos algum perfil de melhora aqui.]",
      "perceived_impact": "moderado",
      "perceived_type": "efeito_incorreto",
      "player_capability_id": null,
      "player_module_id": null,
      "recorded_at": "2026-09-14T17:06:55.533098Z",
      "schema_interaction_event": 1,
      "system_suggestion": {
        "module_id": "rules_and_character_state",
        "capability_id": "roll_execution",
        "confidence": "alta",
        "evidence": [
          "S022-I0031: d20 2 + 7 = 9 contra CD 13, com CD declarada antes da rolagem.",
          "A transcrição da sessão inclui sucessos de Furtividade 17 contra CD 12, Acrobacia 21 contra CD 15, Acrobacia 19 contra CD 16 e Furtividade 16 contra CD 15.",
          "As duas contenções foram resistidas por resultados 19 e 18 de Darran contra CD 15; são resultados improváveis em sequência, mas possíveis e preservados."
        ]
      }
    }
  ]
}
